{
  "event_id": "evt_a1b2c3d4",
  "version": "1.0",
  "event_type": "AGENT_STARTED",
  "actor": {
    "id": "agent.openclaw.demo",
    "type": "agent"
  },
  "runtime": {
    "name": "openclaw",
    "version": "0.1.0"
  },
  "timestamp": "2026-07-07T12:00:00Z",
  "state": {
    "before": "created",
    "after": "running"
  },
  "payload": {
    "task": "hello world",
    "parameters": {}
  }
}